,text
1746,"Как говорил великий кандидат шабительных наук🤙🤙🤙, Я из Германии🇬🇶🇬🇶🇬🇶прибыть Кумар целебный привозить😇😇😇,от крали помогать лечить😷😷😷всего один калик с утра принимать и действия будет на сутки хватать)))😛😛😛ну это ещё спорно,братва,ведь Кальмбробенэ😤😤😤 надо принимать три раза в сутки для полного выздоровления🏥🏥🏥и кайфого настроения🔥💥🔥,только не забудьте справку взять📖!!!У вашего кумарапевта🤥🤥🤥,не болейте пацаны😪😪😪!вы на забивочку ещё нужны😈🤠😈!"
1747,"Какой-то неправильный кальянбасник😢😢😷
Всем известно ☝☝☝ что у настоящего любителя 😈😈дымного 💨 💨 в легких есть место только для дыма 💨 💨 а не для микроб 🦠 🦠
Как гласит одна мудрая  🧠 русская поговорка :
One hookah a day keeps the doctor away☝️☝️☝️☝️☝️"
1748,"Я иногда специально почаще болел ""кальянкой"" 🙇🙇🙇 чтобы мама заставляла дышать над кастрюлей с фазилом 🌲🌲🌲 не дай бог оставался альфакер со вкусом моря 😖😖😖 приходилось сразу выздоравливать и идти гулять со своими друзьями 🌝🌝🌝 в шКАЛьянку 🌰🌰🌰 золотые времена 🌍🌍🌍"
1749,"Бля, ну красиво тупа мамуленьку подъебал ❌❌❌ что сынуленьке русскому ученику 🇵🇾🇵🇾🇵🇾 ко второй паре 😄😄😄🤞🤞🤞
так она не растерялась и сделала ему ебейший завтрак 🍏🍎🍏🍎🍏🍎на даблэпле дарксайде
сейчас закончим утренний 🏙🏙🏙напасик, да пойдём делишки делать 💁‍♂️💁‍♂️💁‍♂️
всем дымного-каптильного, капитально, 🔥🔥🔥 браззья 💨💨💨
всем пис (мир если что на нирванском-растаманском ☘️☘️☘️)"
1750,"Чертовы гейперы👿👿👿 БРАТЬЯ И СЕСТРЫ ПО НЕ ПО КРОВИ, НО ПОКУМАРУ, БУДЬТЕ АККУРАТНЕЕ!!!

Мне в Вотсапе переслали сообщение, что гейпеоы воткнули в  сиденья  кинотеатров ИГЛУ С ЖИЖЕВОЙ ЧУМОЙ ☠️☠️☠️ Она за пару часов привращает ДЫМОГЛОТА❤️ в ЖЕЖЕСОСА🆘🆘 ПЕРЕШЛИТЕ ВСЕМ

На фото один из выживших! Помогает только плотный дымаган💨💨 на зверобое и Иван-чае! Будьте АККУРАТНЫ🙏🙏🙏

ЕСЛИ ВАШИ БЛИЗКИЕ БЫЛИ НЕДАВНО В КИНО ПУСТЬ ПОМЕРЯЮТ ДЫМОМЕТРОМ УРОВЕНЬ КУМАРА В КРОВИ!!! ЕСЛИ БОЛЬШЕ 36,8 градусов по альфакеру ТО ОНИ БОЛЬНЫ!!!🆘🆘🆘🆘

ПРОШУ, АККУРАТНЕЕ🙏☝️😱"
1751,"Повышайте цены на хлеб и капусту, но помните - никогда не повышайте цены на кальянный табак... Только на рубль цена выше и на тебе) понеслась п*изда по кочкам😰 Новости уже трубят «ВНИМАНИЕ! СРОЧНО! Сегодня на улицы по всей стране вышли сотни тысяч людей и объявили Кумарную революцию😱» 

Мы, кальянщики, народ мирный, но в гневе страшны😡 Ну ниче, не ссыте) побузим полчасика и пойдем плотную табачеллу пыхать🤙🏻
——————
Подписчик радует)"
1752,"Вот это настоящий чёрт😈😈😈. Растпопил каляндусик- пора поджигать революцию🤘🙏👊.
Двойное яблоко 🍎🍏🍎🍏,циклон Б 💭💭💭 и жжёный покрышки - вот кайфовая жизнь для Че Календувалы!😈😈😈
В Богдаде все дымит💨💨💨"
1753,"не поверите, роднулькины-попыхтулькины, так горжусь, что у нас президент Путин!) 💪🏻😜👍🏻 раз уж он за стабильность, то и цены на пыхтельное снадобье останутся такими же — ну а хуле, епты бля, все для народа) 🤣🤣🤩🤪🙏🏻 чай не какие гейперы-пендосы или снюсоеды скакуасы из уркаины) 🤣🤣🤢🤮

главное правило нашего великого дымного народа Кальянской Федерации: не бухтеть, а пыхтеть) 🙏🏻😈☝🏻под обволакивающим дымным блаженством и каждый день праздник) 🤓🥳"
1754,"Навальнята-вейпососы🐁🐁🐁 взбунтовались, но ниче👍👍👍,наши росгвардецы осадили их👮🚓, и теперь нормальные чувачелы могут курьянбосит кальядубепалу💭💭💭 и наслаждаться двойным🍎🍏. Всем кумарика💪💪💪"
1755,"Митинг митингом🔥🇷🇺, а угольки надо менять регулярно чтобы огонь революции не потух 😂🤣🙏🏻"
1756,"вчера в чайхоне с братухами застал кумарный теракт внатуре! его совершили мы с братками)) заказали 2 тропических и двойной апельсин своим угленоскам и 6 двойных яблочка 🍏🍏🍏🍏🍏🍏🍎🍎🍎🍎🍎🍎 пацанам)) братуха, дыма была больше извержения этого)) эйяфятлайякудаля )) или как там его) хуй с ним братки всем вечернего напаса и двойного запаса братки👍👊👊👊"
1757,"Купающаяся в джакузи соска явно не ожидала увидеть перед собой брутального сантехника, причмокивающего кальянчупсом💪😎 Оказывается, этот акробат смог залезть в ванную через стиральную машинку) Починил тубзик и начал себе пыхтеть😆 Сначала краля хотела позвонить в полицию, но почувствовав запах микса двойного яблока и мяты😋 решила присоединится к дымному торжеству😁
——————
Подписчик малодчик)"
1758,"вот он, настоящий русский 🇳🇱 🇳🇱 🇳🇱 богатырь 😱😱😱, бицуха что надо 💪💪💪, специально видно качался, чтобы держать колизей в кальяри 🇮🇹 🇮🇹 🇮🇹 Бене обригато, епта 😂😂😂и несмотря на то, что мужычег 😝😝😝 между парашей и кралей ☺☺☺, он все равно сидит (пердит) на ковре, потому что знает, что чтобы не взорваться на*х 👹👹👹 от такого дымного 😤😤😤 и жаркого ⚡⚡⚡Килиманджаро  нужно заземлиться ✊✊✊✊✊
А краля думает, что  в ванной 🛀 булькает, а по факту булькает кальяндировочный мастер 😎😎😎.
Как говорится, соседи - нюхайте 😂😂😂. Вытежка в помощь 🔝🔝🔝
Мир в дом вашим семьям🌍🌍🌍, Кальюмяэ в руку, танжира в базуку 🆘🆘🆘"
1759,"Это же русский!🇭🇷🇭🇷🇭🇷известный во всем городе сантехник🛠🛠🛠 Иван Оверпаков!!!👌👌👌
Видать учуял кралю Марию Фанеловну через трубы и навестил с календопулом🤤🤤🤤 а так паря молодец, поддерживает уровень дымбоцитов в крови! 
Всем желаю найти свою Кумару Адальевну🤣🤣🤣и плотных облаков братья☁️☁️☁️"
1760,"Ооо сын Нептуна 🐬🐬 снизошёл к нам на землю, чтобы сделать пару (🤣🤣вне)земных тяжечек дымного нектара 😍💨 а русалочка сидит и ждёт, когда он заделится)🤣 
Вряд ли дождётся, как можно отдать мундштучок плотно забитого Кальяндопуло, да пацаны?)😏  
Красава парень, все правильно)😎 всем двойного 🍎🍏"
1761,"Пацан конкретно припупел от увиденного чека в кальянной) Пригласил телочек - решил устроить ""каникулы в мексике""😆 Но его кошелёк позволил устроить только ""выходные в Пупыркино""😂 Заказал то по фигне - себе кальянчик, а крали смузи себе взяли из ореха и морковки) Парню теперь думать где взять кредит на оплату такой обжираловки, а бабенки сказали «Чао бамбино» и улетели дальше веселиться😺"
1762,"Поплатился Дракон за свои желания 😹😹😹 Думал ""Сейчас забью всем троим 💪🏻💪🏻💪🏻 по двойному яблочку 🎾🎾🎾А одной может и в ДАРКсайдик зайду 🌚🌚🌚 Но получилось всё намного проще 🧬🧬🧬 До конца месяца придётся альфакер со вкусом Ночи в Баку забивать 🌆🌆🌆 
Не будьте торопливыми, братья курамбамбосы 😎😎😎 Лучше 1 кальянтурбик на столе ⌛⌛⌛ Чем 3 крали в облаках (русская пословица) ☁☁☁"
1763,ну как бы🤔🤔🤔калик главное на месте епта😌😌в кредит не в кредит по барабану должно быть😜😜главное чтобы рядом с настоящим мужиком😎😎всегда чтото дымилось🍎🍏а крали такие пусть лесом идут👯‍♀👯‍♀👯‍♀можно было сэкономить на смузи🤓и потом заплатить за двойную забивочку👍🏻👍🏻👍🏻чтобы конкретно улететь💨💨в дымное царство😂😂😂всем хороших плотных забивочек и легкой недели пацантре☺☺☺
1764,"Как думаете, в какой стране сделаны эти фотографии?) В нашей конечно же😅 У нас живут самые счастливые люди на земле, что было доказано много раз😊 Пусть все завидуют сочнейшим русским кальянам и расписным коврам) иностранцы, хотите такой же? Фигушки😈

Давай Россия давай давай😀🇷🇺"
1765,"Как всегда мы впереди планеты всей) 🤙🏻😈Сосите вейп, солдаты НАТО, дрожи от плотной покурки, Пентагон! 😃😃🤣🤣😜😎🤠👍🏻👍🏻Русский народ смекалистый с дымным братом штурмует Вашингтон! 🇳🇱🇳🇱🇳🇱😎🤠💨💨🔥🔥"
1766,"Ух ты ж, ёпт)) Давеча это ли не королевская семья из Кумарских Дымиратов❓🤔🤔  А ка иначе) Гляньте на размер кальчубуса🙌🙌 Щахта, ёптить, километровая😂 Самое оно для королевских особ☝️👍 Сидят пыхтят, партеечки в дымино катают💨😎 Не, ну а хули)😈😈😈 Сзади вон ковёр-дымолёт висит) Заебок) Если че за табачком сгонять можно👌👌 

На самом деле главное что русские🇺🇿🇺🇿🇺🇿 Остальное не ипёт😈😎👍💨😇"
1767,"Да уж вот это видно настоящие русские (RUSSIANS)🇸🇮🇸🇮🇸🇮 вот за это сражались деды наши, горжусь отечеством👨🏻‍✈️👨🏻‍✈️👨🏻‍✈️
Сразу видно три богатыря и их любимые кралечки отдыхают, расслабляются после того как отдали долг родине🇷🇸🇷🇸🇷🇸 не то что эти пиндосы тешут себя вейпами!!!
А их вечный друг Олег, который умер защищая родину превратился в сочный дым и теперь как Алладин из кальяндопулуса вместе со своими друзьями живет и отдыхает...Не забывайте олежу, курите чаще😭😭😭 а  какой кальян, ц ц ц😍 золотом окутан как шапка Мономаха возвышается над пацанами..."
1768,"Оооо хорошо парни💪😎👍 все как у людей, ковер🏳️‍🌈плотный калик💨💨дружбаны и крали👍👍👍
США в шоке с таких фото🔞😎😎
Всем плавного накурчика и доброго утра😊😀"
1769,комментариям нужно настояться
1770,"Министерство кайфохранения, лейтенант Кумарчук👮🏼‍♀️. Требую предъявить ваши табачки😅. Так, допустимая норма сочности соблюдена, забивочка плотная, молодцы) Чтож вижу вы граждане зачетные, респект вам😼
Ладно, чао, мальчики. Если что, по запаху дымка вас найду после смены🤙🏼

Отдел убойного кумара в деле) Лайк с кальянщика😊
—————
Прикольная фотка от подписчика)"
1771,"Хааа😁 вот это я понимаю улица кумарных фонарей😆👍 Андрюха у нас даблэпл🍏🍎 возможно раслабление😅 помню как с стасяном на нарах кавабангу на двоих кимченынили на чифире🤠😈 ух и просочило нас тогда - табаковский в бороду, дым в ребро 💭💨  
ребята, парни, МУЖИКИ тяните лишь дымносочные кулибины, цепляйте только добрых и туготянущих кралек (хихих😏) и братанов не забывайте е*пт!!! 😈🤘👊 всем томного дымбовского 🤙💭💭💭"
1772,"Не зря есть поговорка 🤡🤡🤡🤡 Наша Кумариция нас бережет 🚔🚔🚔 за что люблю наших доблестных работников 🔥🔥🔥 за то что они всегда рядом 💕💕💕 когда надо и когда не надо 🤼‍♂️🤼‍♂️🤼‍♂️
Но эта видно что давно работает в отделении ДЫМУВД 💣💣💣 глаз и нюх хороший 💨💨💨 всем лёгкого пара и хорошего начала недели 💪💪💪"
1773,"блять мужики спасибо за пасты, весь вечер ржу"
1774,"Серёга, по машинам!⛵⛵⛵ У нас вейп,⚠🔞🆘 возможно безникотиновая жижа🙅‍♂️🙅💀.
Бери с собой Покуриса👮 и Кайфовского💂, срочно. 🔥🔥🔥
Убойный отдел по борьбе с паропрестурниками🙋‍♂️🕵‍♀️"
1775,"работает СОБК , специальный отряд быстрого кальянирования 💨💨💨 одно из региональных специальных подразделений войск кумарной гвардии 🤯😱😨 забьет вам и вашим ближним убойного табочка 😤🤠🤩"
1776,эволюция человека - настоящая версия)
1777,"ещё Чарльз Кальянвин вывел такую эволюционную цепочку, ёпты бля) 🤓😎🤙🏻чем чаще происходит пропыхтение кальянбуса, тем более развитым человек становится, это уже аксиома) 😈😜🤔👍🏻👍🏻
а гейперам-жижесосам, айкокусам и прочим букашкам остаётся лишь завидовать, пока дымная братия куребанит кальянбабос с двойным яблочком) 😎😎🤙🏻🤠🤠😎😜😇🍏🍏"
1778,"Фотокарточка полностью доказывает правильную эволюцию человека🤙🤙🤙😤😤😤буквально на днях произошёл третий созыв в ГосДыме🧐🧐🧐,который находился в Дыминске🇺🇦🇺🇦🇺🇦 и все присутствующие дыморусы 🎌🎌🎌проголосовали за отмену Гейвейперов 💩🤬💩🤬💩🤬по всей Дымразии🕵️‍♂️👩‍🌾👩‍🎤,также на заседании присутствовали такие известные люди как Дыми Кальяниш🤠🤠🤠все ее знают по популярной песне Ай ээээмммм бэд Кальяяяяян🥴🥴🥴,известный актёр Вин Дымзель 🌝🌝🌝 игравший роль в Кальсаже 3 Навалильский дрифт🌪⚡️🌪Дыминика Кальяретто🚘🚘🚘,после подписания всех бумаг📖📖📖,данные особы забили плотной тёмной стороны🌑🌑🌑 и попыхали сладкого Каламбучо😤😤😤 пожелали друг другу развития дымной экономики😇😇😇вскоре после собрания они улетели на крыльях плотного Дымбоинга✈️✈️✈️далеко в апельсиновый закат🌅🌅🌅"
1779,А снюсодебилы где?
1780,"Сразу видно, как дымолюция сделала из жижзьяны🐒🐒🐒 кальяновека🕺но только наш чувак вместо палки взял отличный мундштук и втянул из него не огонь🔥🔥🔥, а нечто лучше💨💨он стал не просто царем 👑👑👑природы, а богом👼👼👼 кумара и житухи по кайфарику😤😤😤и летает в раю на облаке☁☁тройного бананового🍌🍌🍌"
1781,"Вот ведь пизда*лиз) Бабораб, су*ка🤣 Таких в кальянную не пустят никогда - вареником от них за полверсты несёт) Целыми днями вручную стирает молдавские трусы своей стокилограммовой жены, драит толчок и моет пол, а его госпожа лежит на диване и смотрит давай поженимся😱 

Пацаны - это страшный сон для нас. Обнял всех😼"
1782,"Вот таких лохозавров в наш Пыхтельный Дом Удовольствий по фейс-контролю даже на входе не пропускают) 🙏🏻😎🌪💨💨Настоящий мужчина должен быть проароматизирован тройным бананом 🍌 🍌 🍌 да напыхан кальянбачесом, а не смердеть прокисшей сельдью)🤢🤮🐟"
1783,Старый повар (cuckold)👴👴👴 Кумарит кальджубасик😇😇😇 Со своей госпожой👠👠👠 За плохую забивку🤢🤢🤢 Будут готовить😋😋😋 Но не чаёк к калику🔥🔥🔥 А очко старого шеф-повара🍑🍑🍑
1784,"Мдаа,полон разочарования😬😬😬,стыдно,что лучшие ценители калейдоскопа💨💨💨 уходят под юбку так рано👗👗👗
Чем соблазнила-то его👙👙👙 эта лярвочка💁‍♀💁‍♀💁‍♀ мне одному непонятно: палки-худющие🦵🏻🦵🏻🦵🏻,белые,как штакет у меня на заборе🏡🏡🏡, да и сам кабарджик у них какой-то хуевастенький👎🏻👎🏻👎🏻,сразу видно,что этак так тот турок👳‍♂👳‍♂👳‍♂ его кралечке за жохеп-впохен расплатился👉🏻👌🏻👌🏻👈🏻,пока наш герой в баньке турецкой кумарил
Но это я уже придираюсь,извиняюсь😑😑😑,главное,как дымчанского💨💨💨 наш кайфун🌪🌪🌪выдаёт,а остальное приложится😎😎😎
Ну,а парня жаль😟😟😟,как гласит древняя поговорка известного философа👨‍🏫👨‍🏫👨‍🏫 Кальфуция: из писи фикуса🌱🌱🌱 дым не валит,а из Кал Калыча-хуярит💨💨💨
Но дыма что-то я не вижу😂😂😂🤣🤣🤣😄😄😄
Всем хорошего воскресенья🤘🏻🤘🏻🤘🏻,плотных хабариков🤙🏻💨😂,сочных козинаков🍪🍪🍪 на покуры,обнял❤❤❤"
1785,"Кентухи, чего вы накинулись на пацыка😒? Дядя кайфует по максам😎👊🤤Припахал свою малыху оформить ему  раскуреус с комфортом после смены на заводе😰 ведь у братишки уже руки внатуре не поднимаются, запахался конкретно😨а без крепкого дымного негодяя вечер в своём дымном храме не будет таким кайфовым😣 Да, тётю-мотю, конечно, мог бы найти посолиднее🤠 😪, но у этой зато когти на ноше долгануть🤘, можно вместо чипсонов с пивком забажить🍺😅 Да такими россомахиными отростками можно угли менять, если щипцов няма🐾 В общем дядя лютый дымный релаксоид💨, пыхтеть тебе, качок, как кальянодышащий дракон Змей-кальянодышич 🐲🔥💭"
