,text
0,"Деньги в кармане 
Жена на диване
Сын на борьбе 
Житуха по кайфу)"
1,"А все вижу, извиняюсь за наезды, братва, всем лёгкого дыма и крепкой мужской дружбы😈🤘))))"
2,Вы какие-то отбитые тут все 👌😃🇺🇦🐷😜✡️🐖💨))))00))0)
3,"Классная группа ☺️☺️😛подписался с женой теперь двигаем на кайфе 💭🤙 ❤️раньше она изменяла но сейчас мы курим вместе 😎
Заебись паблик админу салам алейкум 🤝остальным чисто ебать давайте работайте братья 💪💭💪"
4,"Дааааа ☺️☺️☺️
Братья, я такой калик вчера со  своей девушкой-проституткой забил, что мы улетели на небеса 🤪🤩👌❤️😍😍👌👌😤😤😊😊😊
Мой лучший друг увёл мою бывшую и кинул меня на деньги 🤭😝🤪
Но вчера мы хорошо подули все вместе в калике 👍👍👍👍 #каликрулит"
5,отдуши мужики такую группу  чумовую забабахали)))) 😆😆😆😆
6,"Желтые братишки👨
Китай рабочий сидят отдыхать🇨🇳👍🏼 Курят вкусная кальян дым💨😋 Кто курить больше - получать двойной порции риса🍚2️⃣😱 Кто курить дым в виде портрет Великого Xi получать 300 балла rating🔝📈Показать краль-кошек нефритовый стержень😈😏

Настоящий гражданин Китай) Уважают лидер любят лидер партии😍 Мужчина кальян курит - дракон🐉 Мужчина ве*йп курить - любит другой мужчина🤮🚫"
7,Классный город Пыхьян)
8,"Плюс 500 очков кумарного💨🍎🍏рейтинга, Xi гордится тобой"
9,уважать☝🏻 императора XI😎 - получать двойная (double) порция яблоко (🍏🍎). Не уважать - получать горький рот.
10,Раковый форс долбоёб смеяться
11,"Поднятие🏹🏹! Простой рабочий ⚒Иван город Тверь 🏘🇻🇳. Курить тут кальян🌪горьчить, пахнуть грязный вейп🤢🤮. Читать на досуге журнал Нефритовый Кальян ‼📖 и мечтать кальян от великий Xi. Переехать🚗 Китай🇻🇳, тут давать двойной порция яблоко (双苹果)🍎🍏 хороший забив 👍🏻✊🏻 🤙🏻 и кралль жена👱‍♀🔞🔞. Считать коммунистический кальян 🇻🇳☁ лучший!"
12,"Потерял дар речи🤯
«Ууууух б*ляяяя вот это дааааа пи*здеец😱» Мужик впервые в жизни увидел кальянчик) Ничего, скоро шок пройдёт🔥😳👍🏽 У всех в первый раз такая реакция🙈🤩 Ты ещё табачка забей да пыхни по царски - вообще в космос улетишь🤣👽Отвечаю)

Нечего ржать братва😹 Вспомните, как поначалу от дымка с ног валились💨🥵 Было дело?)"
13,Так это же профессор Дымкс 😤🎓! Первый в мире человек кто курит кальджубасик силой мысли 🍎🍏. У такого и не прочь домашние задания делать и занятия посещать☝😏
14,Представляю🤔 как чувак (man) после забивочки с двойным (x2) яблоком🍏🍎отпыхтеет! Помню свой первый калюмбас🤤🤤🤤 сначала не поняла куда мундштук совать🤣🤣🤣🤣
15,"Даааа 🇨🇳 пых-пых жёсткий 💿быть словить пацанчик 💨💨😜 но вот в Китай🇨🇳 народный👨‍👩‍👧‍👦👨‍👩‍👧‍👦👨‍👩‍👧‍👦 республика 😎 сам великий Xi ☝ kальян4ик🏮 забивать 🍏🍎 а его нефритовый😋 стержень 👑 давать кальяну 🔭🚬 невероятный🧐 способность калюмбусить 🤯🤯
🖐️Поэтому приезжать 🚕 в Китай 🇨🇳 и наслаждайся😏 пых-пыхом 💨💨. Я есть просто Андрей город Ижевск, это не есть пропаганда!!!"
16,"Дружок, ну чего ты стоишь? 🤨 Беги кумарить уже 😁 С двойным яблочком 🍎🍏(tuepl) и жизнь не так плоха, как кажется 😤 У всех бывает первый раз, и калик тут не исключение 😳"
17,"да нет же 😂паренек просто думает о том куда чаша пропала с двойным эпл(apple)🍎 😂😂, 😵наверно украли, вот и продумывает с помощью дымдукции🤠🤔🤔 👍, настоящий Дымлох Холмс😎😎"
18,"Удалые красавицы😜
Зацените) Бабенки то жгут😂 Решили посидеть в компашке, пощелкать фисташки👩‍❤️‍💋‍👩🥑 А кальянчик не нашли😱🤬 Ну и сделали свой👍🏼 Стыбзили у мужей двигатели с чепырок, сварили и присобачили по шлангу👏🏻 Челябинский калюмбасик, епт*ыть🤣

Вот так девчонки) Таким макаром всю Америку отожмём👊🏼😎 С нами лучше не шутить😈"
19,"Вот это я понимаю ""Пыхцанки"" 👹👹👹
У Михалыча забрали аппаррат 😡😡😡 Что он теперь делать-то будет? 🙏🏻🙏🏻🙏🏻
Побежал наверное в огород 😩😩😩 За наливными яблочками 🍅🍅🍅 Чтобы показать этим девчонкам 👩‍🔧👩‍🔧👩‍🔧 Как он в своё время на трёхлитровой банке с россолом 💥💥💥 Забивал кальджунвауса, что вся деревня потом ходить не могла 🎿🎿🎿"
20,"Вот это понимаю изобретатели🇵🇭🇵🇭🇵🇭 тут даже Илон Дымаск👨‍🔧 стоит в сторонке со своим Пыхейсом Х🚀 Черный калюмбасик белого цвета вещь💎!! Вот сразу видно счастливые лица😀 на лице насстоящих краль👠💄. Обратите внимание на красный (англ. blue) мундштучок, такая форма пропускает кумар💨💨 в дабл раз лучше, а если еще забить дабл яблочко 🍏🍎, то дабл умножить на дабл получится трипл🥉, и с таким сетапом сразу без визы улетаешь в Кумарландию🏝"
21,"Редкие кадры со съемок сериала ""Пыхальные пацаны"" 💭💭"
22,"А это Пыхлябинск☁️🥳. Пыхлябинские бабенки (men🤡) настолько суровы👨‍🔧, что за одну тяжку🚨 скумаривают сразу 2 яблока🍎 🍏"
23,Вот так и появляются 🙌 пыхменистки 🙅😤 сами забивают себе плотный 💨💨 калюмбасик из подручных 💅💪 средств с двойным 🍏🍎 яблочком.  Без помощи ❌❌ м*ужчин (соре за м*ат)
24,"Скорая помощь🚨
А вы знали, что существует служба горных кальянных спасателей?) На большой высоте может возникнуть резкая нехватка кумара😱☠️🏔Тогда на помощь спешат кальянчики😳 Делают инъекцию дымоглобина бедолагам-альпыхнистам😺💨🧗‍♂️ Спасают пацанов от острого недопыха👍🏼

Спасибо вам, кальджубасы😇 Всегда в трудную минуту из беды вытащите)"
25,Спасатели Кали Бу
26,Говорят что на Дымолугме💨💨 есть дерево🍃 на котором растут (growing) сочные  арр1ес🍏🍎 именно тибетские мудымцы👳‍♀️👳‍♀️👳‍♀️ придумали этот микс и так они путешествовали по Кумарболе🦄🐍🐲
27,"Еще существуют собаки породы пыхбернар 🐶🐶🐶, прямо как в фильме Вейпховен, которые вытаскивают неудачливых кайфариков 🤕🤕 из под завалов угольков 😨😨
Горы - опасное место, пацаны ☠☠☠"
28,"Хотелось бы конечно стать поКУРителем Дымвереста🤙🏽😎

Ещё мой дед 👴🏽 (stariy) говорил: «Лучше гор, могут быть только горы где ещё не кумарил⛰🏔🙏🏼"
29,В ожидании пока комменты настоятся
30,"Любовь сильнее страха💖
Мужик по настоящему любит свой кальянчик) Уединился в джакузи и шалит с ним, озорной😈😏 Красавчик - не скрывает свои чувства😻 Настоящий дымос*эксуал👍🏼💨🔞 Уважайте нашу любовь, иначе устроим пых-парад и мало не покажется👊🏼👨🏻🤯

Респект этому храброму участнику ЛГБДЫМ движения💪🏼😎 Братва, не бойтесь быть собой🙏"
31,"я, конечно, толерантна, но абсолютно против вейпосексуалов 🥵
в Китае их признали больными, поэтому пусть все дружно туда и валят 😎
пусть не оскордымляют Россию Кумарушку! 🇷🇺

з. ы. а перед такой цензурой, как на фотографии, ни одна краля не устоит 😋 
сразу можно узнать, какого мужика выбрать: свою гордость гейпом не прикроешь 😂🤣🤣🤣
отличный подарок на 8-е марта, е-мае))))"
32,Ох мужик😆🤙🏻 залез в джакузи и кумар ловит🤣🤣🤣 главное свой мундштук не простудить😰 а то как потом крали будут раскуривать❓❓❓ а колбу зачем 🤦‍♀️ в годы Великой Кумарной Войны наши дети в луже курили и нормально💨💨💨 ну мужик молодец в любом случае! реальный ПЫХатырь😆
33,"Ух какой Nepпыхtune 🎵 💨 
В любом случае калыванчик на воде , так ещё и в воде 🚿 💦 🤘🏼
Забивочку плотную на double apple 🍎 🍏 забил сидит кайфует , прикрывая своё хозяйство 😹 🍆 
Не поспоришь , настоящий русский 🇩🇪 отдых 💆‍♂️ 
Мужик не тот, кто в instagramm посты делает 😤, а тот, кто кальянчик дымует пока моется 🧽 Кралям на заметку 📝 😉 
Кумарного всем 8 из 10 марта пацаны 😄"
34,Ждём пока комментарии настоятся😃😎
35,"Ребята, не попадайтесь на пропаганду⚠
На самом деле это не калик💨💨, это водник (H2Oдник, по научному🤓) и забивка не двойное яблоко (dabl aple🍐🍑), а вейперская шушара🐔🐔🐔, проклятые гейперы-наркоманы совсем уже потеряли страх и суют нам всякие непотребства🔞, вместо нашей славянской забивочки🇳🇱🇳🇱🇳🇱
Это все проделки мифической гидры🐲🐲🐲🐲🐲🐲🐲, не ведитесь на ароматные облака, иначе окажетесь на обочине жизни🛬"
36,"Архивное фото😄📚
«Эу, чорножо*пый, а ну-ка угольки мне поменяй😈» Нехило краля напрягла бедного арапчонка🤦🏻😭👨🏿‍🦰 Раньше бабы были злые и дикие) Но после долгих лет селекции и дрессировок они стали добрее🥰👱🏼‍♀️ Чудом усмирили этих злобных лярв😂

Нельзя обзывать темнокожих) В наше время нужно помнить о равнодымии и толерантности😎👍🏼"
37,"DOUBLE APPLE LIVES MATTER!!!
Слава Мартину Лютеру Дымкингу, за то, что боролся за права угольков!

Американский баптистский кальянщик, общественный деятель и кумаролог, получивший известность как самый заметный представитель и лидер движения за гражданские права угольков каля в США с 1337 года до своей смерти в 1488 году. Кинг выступал за защиту гражданских прав с помощью ненасилия колбы и гражданского плотного пыха, тактик кумара, вдохновлённых его кумарными убеждениями и ненасильственным активизмом Махатмы Кумарди."
38,"По лицу (feis) 😑 видно затяжка не понравилась 😦, кальянщик чорт 👿👿👿 Щас она 🤙🏻 его вместо колбы 💣 насадит на шахту 🌈 и побулькает ёмаё) 💨💨
Ещё в древнем поселении Танжоидов ⭐ и Фумароведов 🔥 говорили «Арабы хранители дымка» 🍎🍏
👥Гендеров в этом мире много (two), а калик всего один 🆘
Берегите его друзья ❤, давайте жить дымно 🙌🏻🙌🏻🙌🏻💋"
39,"не важно какого цвета ты, главное чтобы яблоко кумарное😉☝🏾🍎🍏💨💨💨"
40,"Ээ ‼️⚠️ краля 🍙совсем берега попупатала (change) 🆘🆘 С ногами на диван залезла😤😤 Будь на месте уголька🌚 нормальный русский🌈🌈 мужик (fucking slave), он бы ее мигом через прогиб 🤼‍♂️ воткнул за такое неуважение (disrespect) к кумарным традициям 👍👍"
41,Дарксайдик
42,"Ошибочка вышла😳
Подумали, что этот психопат хочет заживо сжечь бедный кальянчик?) А ну-ка без паники😱🙅🏻‍♂️Просто мужик новичок в нашем табачковом деле👨🏻💨🤣Походу не так понял фразу «замути калик на углях»Не с*сы, старина🙏 Все допускали такие ошибки🙈

Да уж, мир полон сюрпризов👍🏼 Как говорится, встречают по забивке, провожают по мундштуку😼"
43,"На самом деле это ужасающее фото из прошлого 🙀
Тут запечатлена смерть великой французской 🇷🇺🇷🇺🇷🇺 кумарини Жанны д'Ым 🤰 Она возглавила целую армию французских 🇸🇦 кайфлиеров в ходе Стояблочной войны 😯😯😯 Но увы, её осудили как кумаретика и сожгли 🔥 на костре(( Остались только угольки 🤣🤣🤣 Да, грустная история (funny)
Давайте не забывать великих героев, ведь они умирали за наш раскумар 🤙🤙🤙"
44,"Да мужичок видно прикалывается😁 шутник дымной, погремуха дымоджокер😂 шутит над подписчиками✌"
45,"Хорошо👌🏻👌🏻 что паренек просто неопытный🤓🤓) А то с первого взгляда👁👁 можно его принять за чле*на Каликуклус-клана🦹‍♂🦹‍♂ Для тех, кто в танке🚴‍♂🚴‍♂ ККК - Кальянно💭💭-карательная👊🏻👊🏻 картель - организация самых отбитых🤪🤪 жижасосов👬👬 заманивающая кумарил😤🤤 ароматом двойных яблочек🍅🥝 и затем пытающая их🏹💉 до потери сознания😵😵 и тяги к кальянчикам😒😒 Благо против этой организации🏳‍🌈🏳‍🌈 начал активную деятельность👨‍💼🕵‍♂ один их самых маститых пускателей навалистых колечек😚💨, борец за свободу смачного покура😤✊🏻 - Кумартин Лютый Пых🤠😈
Наше дело правое✌🏻👍🏻💪🏻 - победа будет за нами🙏🏻🤞🏻🤘🏻🤙🏻🥝🥝🍅🍅"
46,надеюсь костерчик пахнет райским дабл эплом 🍏🍎
47,"самое кайфовое, что пацанчик на природе кумарит
эколог)))"
48,"Рубрика «Жизнь замечательных людей»☝🏻
Знакомьтесь - Сергей Кумарников по кличке Турбонадув💪🏼😎Именитый деятель 90-х годов) Бывший бандит и дымный романтик🤙🏼😈 Открыл первую и единственную кальянную-тир💨😳🎯 В 2004 году он был назначен Пыхтуном в законе👑👏🏻

Настоящая легенда кальянного мира😱 Говорят, помимо колечек, он выдувал золотые купала😼👍🏼"
49,"Эх, пыхие 90-е! 😎💨"
50,"Такому 🤙криминальному🔫 пыхтаритету😤 и калюмбарик подать не стыдно💨. А после кумарной забивочки🍏🍎 и на забив👊 не страшно💪.
Кумарь 😤💨себе на здоровье🏥, родной🤙️, да только не забывай 🧠 угольки переворачивать 🔥️. Солидным людям👔 солидный пых💨"
51,"Его бизнес по бороде пошёл как всратые гейперы появились.. . Помните тот известный видос ""Ебаный рот этого лаунж бар"" 😬
upd:
""... – ВЫ МУДИЛЫ!! Вы чё, е.. блять.. Ёб твою мать, в кальянной, сука, парить вейп.. ТЫ ЧЁ, ДУРАК, ЕБАНЫЙ ТВОЙ РОТ, А?! Ты чё, кретин, что ли?
– Пар на 95% безопаснее дыма...
– Ты, дегенеративный кретин, ты не понимаешь, что ты говоришь вообще!
– Что есть, то и говорю..
– Ты хочешь сказать, что в моем лаунж бар типа парить из-за этого разрешено?!
– Парю где хочу, законом не запрещено🐔..."""
52,Известный узник ВлаДЫМерского централа ☝🏻😯
53,"🎤🎤""Братва, не парите друг с другом""🙅‍♂️🏳‍🌈️😡😡 
Под аккомпанемент сего шлягера зарождающегося кальянного мира Серый Турбонадув🃏🃏 и Мишка Пыхончик🇰🇷 обпыхивали делишки🥃🥂🐗🐗🐗 по устранению вездесущих вейпшопов🤢🤢, крышуемых извечными конкурентами - Вейперскими🐓, и установлению истинного дымовского🤛💪💨💨 порядка на землях Роисси-колбочки🇳🇱🇳🇱"
54,"Сложно сдержать слёзы 😢
Кадр из мультика Король-Пых👏🏻💨👑 Молодой кальяненок Дымба встречает погибшего отца Жмухасу😭🙏Мудрый король-кальян даёт сыну советы) Как накуривать пацанов с кралями и не вжаривать горчу по гландам💀🤢👎🏼 

Действительно, правильные наставления) Главный мультфильм нашего детства😻 Многому научил😎"
55,"Легендарный мульт ⚠⚠⚠ Подарил нам легендарные цитаты:

""Пыхмба 🎃🎃🎃, я расскажу тебе о том, что узнал от своего отца 👺👺👺. Видишь звёзды, это зарождающиеся угольки 💥💥💥? Великие Короли прошлого глядят на нас с этих звёзд и ждут от нас великих колец 🗯🗯🗯"" 
""Пыхмба 🌝🌝🌝, смелость не в том, чтобы нарочно подвергать себя риску уронить колбярочку 🥚🥚🥚, а в том, чтобы через 1.5 часа попросить перезабить калываныча 🎳🎳🎳""
""Сегодня было страшно👀👀👀... Да. Я боялся потерять тебя, мой личный мундштучок 😭😭😭"""
56,"– Отец, всё... позади?
– Теперь да... Крали не кумарят вечно, сын мой...
– Мой взор... застилает... пар..."
57,"""Король-пых"" для девочек💃, рил, и сентиментальных мальчиков👶, а пацаны смотрели ""Король Кальянов"" 🤙.
Взгляни вокруг, оглянись назад -
Духи кумара с тобою связаться хотят.
Мир не таков, каким кажется он,
Дымом каждый окружен.
Не все вокруг подвластно глазам,
Плотную чашку забить должен ты сам,
Верь в свою судьбу! 
Быть Кальяном Королем,
Всех Кальянов Королем,
Если пых твой силен,
Кальяном Королем!
Я вижу мир, я верю в судьбу,
Гейперам не сдамся, продолжу борьбу,
Я должен победить и быть
Кальяном Королем!"
58,"Скорее голодный лев откажется от калика, чем гейпер от подлости и лжи. (С) Омар Кумар"
59,а как же друзья Дымбы? Дымон и Пыхмба? 😃
